{
  "id": "evt_synthetic_capture_created_001",
  "type": "wn.capture.created",
  "schema_version": 1,
  "actor": "user",
  "status": "recorded",
  "pack_id": null,
  "agent_id": null,
  "source_capture_id": "cap_synthetic_001",
  "source_event_id": null,
  "subject_ref": null,
  "payload": {
    "source_type": "text",
    "text_preview": "Synthetic capture for schema validation."
  },
  "privacy": "local_only",
  "causation_id": null,
  "correlation_id": "corr_synthetic_capture_001",
  "trace_id": null,
  "idempotency_key": null,
  "device_id": "device_synthetic",
  "created_at": "2026-06-26T08:00:00Z",
  "retention": {
    "policy": "inherit",
    "expires_at": null
  },
  "redaction": {
    "policy": "none",
    "reason": null
  },
  "metadata": {
    "fixture": true
  }
}
