{
  "id": "evt_synthetic_transcript_created_001",
  "type": "wn.transcript.created",
  "schema_version": 1,
  "actor": "system",
  "status": "processed",
  "pack_id": null,
  "agent_id": null,
  "source_capture_id": "cap_synthetic_voice_001",
  "source_event_id": "evt_synthetic_transcript_requested_001",
  "subject_ref": {
    "kind": "transcript",
    "id": "tx_synthetic_001",
    "uri": null
  },
  "payload": {
    "transcript_id": "tx_synthetic_001",
    "artifact_kind": "audio_transcript",
    "transcript_status": "active",
    "text": "Meet Alise at 10 AM about the launch checklist.",
    "text_sha256": "bbbbbbbbbbbbbbbbbbbbbbbbbbbbbbbbbbbbbbbbbbbbbbbbbbbbbbbbbbbbbbbb",
    "language": "en",
    "provider_id": "local.sensevoice",
    "provider_kind": "local_asr",
    "model": "sensevoice-small-int8",
    "duration_ms": 8200,
    "chunk_count": 1,
    "confidence": 0.93,
    "segments": [
      {
        "id": "seg_synthetic_001",
        "start_ms": 0,
        "end_ms": 8200,
        "text": "Meet Alise at 10 AM about the launch checklist.",
        "confidence": 0.93
      }
    ],
    "realtime_preview_used": true,
    "fallback_used": false,
    "source_attachment_sha256": "aaaaaaaaaaaaaaaaaaaaaaaaaaaaaaaaaaaaaaaaaaaaaaaaaaaaaaaaaaaaaaaa",
    "source_refs": [
      {
        "kind": "capture",
        "id": "cap_synthetic_voice_001",
        "uri": null
      },
      {
        "kind": "attachment",
        "id": "att_synthetic_voice_001",
        "uri": null
      },
      {
        "kind": "event",
        "id": "evt_synthetic_transcript_requested_001",
        "uri": null
      }
    ]
  },
  "privacy": "local_only",
  "causation_id": "evt_synthetic_transcript_requested_001",
  "correlation_id": "corr_synthetic_voice_001",
  "trace_id": "trace_synthetic_transcript_001",
  "idempotency_key": "transcript:cap_synthetic_voice_001:att_synthetic_voice_001:bbbbbbbb",
  "device_id": "device_synthetic",
  "created_at": "2026-07-01T02:00:09Z",
  "retention": {
    "policy": "delete_with_subject",
    "expires_at": null
  },
  "redaction": {
    "policy": "none",
    "reason": null
  },
  "metadata": {
    "fixture": true
  }
}
